{
  "$schema": "https://json-schema.org/draft/2020-12/schema",
  "$id": "https://etymolt.com/docs/verdict-protocol/evp-1.schema.json",
  "title": "Etymolt Verdict Protocol Verdict Object",
  "type": "object",
  "required": [
    "evp_version",
    "name",
    "verdict",
    "score",
    "axes",
    "verdict_id",
    "issued_at",
    "disclaimer",
    "signature",
    "signature_key_id",
    "signature_payload_digest"
  ],
  "properties": {
    "evp_version": {
      "type": "string",
      "pattern": "^1\\.[0-9]+\\.[0-9]+$"
    },
    "name": {
      "type": "string",
      "minLength": 1,
      "maxLength": 64
    },
    "verdict": [
      "PROCEED",
      "PROCEED_STRATEGIC",
      "ABANDON"
    ],
    "score": {
      "type": "integer",
      "minimum": 0,
      "maximum": 100
    },
    "axes": {
      "type": "object",
      "required": [
        "trademark",
        "domain",
        "distinctiveness",
        "linguistic",
        "cultural"
      ],
      "properties": {
        "trademark": {
          "$ref": "#/$defs/trademark_axis"
        },
        "domain": {
          "$ref": "#/$defs/domain_axis"
        },
        "distinctiveness": {
          "$ref": "#/$defs/distinctiveness_axis"
        },
        "linguistic": {
          "$ref": "#/$defs/linguistic_axis"
        },
        "cultural": {
          "$ref": "#/$defs/cultural_axis"
        }
      },
      "additionalProperties": false
    },
    "verdict_id": {
      "type": "string",
      "pattern": "^v_[A-Za-z0-9_-]{12,}$"
    },
    "issued_at": {
      "type": "string",
      "format": "date-time"
    },
    "disclaimer": {
      "type": "string",
      "minLength": 1
    },
    "signature": {
      "type": "string",
      "contentEncoding": "base64"
    },
    "signature_key_id": {
      "type": "string",
      "minLength": 1
    },
    "signature_payload_digest": {
      "type": "string",
      "pattern": "^[0-9a-f]{64}$"
    },
    "signature_co": {
      "type": "object",
      "required": [
        "signature",
        "signature_key_id",
        "signature_payload_digest"
      ],
      "properties": {
        "signature": {
          "type": "string",
          "contentEncoding": "base64"
        },
        "signature_key_id": {
          "type": "string",
          "minLength": 1
        },
        "signature_payload_digest": {
          "type": "string",
          "pattern": "^[0-9a-f]{64}$"
        }
      }
    },
    "one_line": {
      "type": "string"
    },
    "findings": {
      "type": "array",
      "items": {
        "type": "string"
      }
    },
    "confidence": {
      "type": "integer",
      "minimum": 0,
      "maximum": 100
    },
    "confidence_interval": {
      "type": "object",
      "properties": {
        "lower": {
          "type": "number"
        },
        "upper": {
          "type": "number"
        },
        "point_estimate": {
          "type": "number"
        },
        "method": {
          "type": "string"
        }
      }
    },
    "permalink": {
      "type": "string",
      "format": "uri"
    },
    "jurisdictions_consulted": {
      "type": "array",
      "items": {
        "type": "string"
      }
    }
  },
  "patternProperties": {
    "^x_": {}
  },
  "additionalProperties": true,
  "$defs": {
    "axis_status": {
      "type": "string",
      "enum": [
        "CLEAR",
        "CAUTION",
        "BLOCKED",
        "INSUFFICIENT_SIGNAL",
        "UNKNOWN"
      ]
    },
    "trademark_axis": {
      "type": "object",
      "required": [
        "status"
      ],
      "properties": {
        "status": {
          "$ref": "#/$defs/axis_status"
        },
        "jurisdictions_consulted": {
          "type": "array",
          "items": {
            "type": "string"
          }
        },
        "colliding_marks": {
          "type": "array",
          "items": {
            "type": "object",
            "properties": {
              "wordmark": {
                "type": "string"
              },
              "owner": {
                "type": "string"
              },
              "serial_number": {
                "type": "string"
              },
              "registration_number": {
                "type": "string"
              },
              "nice_classes": {
                "type": "array",
                "items": {
                  "type": "integer"
                }
              },
              "filing_date": {
                "type": "string",
                "format": "date"
              },
              "status": {
                "type": "string"
              },
              "deep_link": {
                "type": "string",
                "format": "uri"
              }
            }
          }
        },
        "nice_classes_assumed": {
          "type": "array",
          "items": {
            "type": "integer"
          }
        },
        "coverage_caveat": {
          "type": "string"
        }
      }
    },
    "domain_axis": {
      "type": "object",
      "required": [
        "status"
      ],
      "properties": {
        "status": {
          "$ref": "#/$defs/axis_status"
        },
        "tlds_consulted": {
          "type": "array",
          "items": {
            "type": "object",
            "required": [
              "tld",
              "method",
              "definitive",
              "result"
            ],
            "properties": {
              "tld": {
                "type": "string"
              },
              "method": {
                "type": "string",
                "enum": [
                  "RDAP_authoritative",
                  "WHOIS_authoritative",
                  "DNS_fallback"
                ]
              },
              "definitive": {
                "type": "boolean"
              },
              "result": {
                "type": "string",
                "enum": [
                  "available",
                  "registered",
                  "unknown"
                ]
              }
            }
          }
        },
        "recommended_variant": {
          "type": "object",
          "properties": {
            "domain": {
              "type": "string"
            },
            "registrar": {
              "type": "string"
            },
            "price_usd": {
              "type": "number"
            }
          }
        },
        "aftermarket_observed": {
          "type": "boolean"
        }
      }
    },
    "distinctiveness_axis": {
      "type": "object",
      "required": [
        "status"
      ],
      "properties": {
        "status": {
          "type": "string",
          "enum": [
            "STRONG",
            "MODERATE",
            "WEAK",
            "BLOCKED",
            "INSUFFICIENT_SIGNAL",
            "UNKNOWN"
          ]
        },
        "cohort_corpora_consulted": {
          "type": "array",
          "items": {
            "type": "string"
          }
        },
        "platforms_consulted": {
          "type": "array",
          "items": {
            "type": "object",
            "properties": {
              "platform": {
                "type": "string"
              },
              "status": {
                "type": "string",
                "enum": [
                  "available",
                  "taken",
                  "unknown"
                ]
              },
              "url": {
                "type": "string",
                "format": "uri"
              },
              "claimed": {
                "type": "boolean"
              }
            }
          }
        },
        "workaround_variants_available": {
          "type": "array",
          "items": {
            "type": "string"
          }
        }
      }
    },
    "linguistic_axis": {
      "type": "object",
      "required": [
        "status"
      ],
      "properties": {
        "status": {
          "$ref": "#/$defs/axis_status"
        },
        "locales_evaluated": {
          "type": "array",
          "items": {
            "type": "string"
          }
        },
        "phoneme_skeleton": {
          "type": "string"
        },
        "sound_symbolism_axes": {
          "type": "object",
          "additionalProperties": {
            "type": "number"
          }
        },
        "advisory": {
          "type": "boolean"
        },
        "method": {
          "type": "string"
        }
      }
    },
    "cultural_axis": {
      "type": "object",
      "required": [
        "status"
      ],
      "properties": {
        "status": {
          "$ref": "#/$defs/axis_status"
        },
        "sources_consulted": {
          "type": "integer",
          "minimum": 0
        },
        "cultural_sources_consulted": {
          "type": "array",
          "items": {
            "type": "object",
            "properties": {
              "source": {
                "type": "string"
              },
              "matched": {
                "type": [
                  "boolean",
                  "null"
                ],
                "description": "true if a hit was detected; false if cleanly searched and clear; null if the check was deferred (e.g., rate-limit shed for out-of-band processing)."
              },
              "language": {
                "type": "string"
              },
              "caveat": {
                "type": "string"
              }
            }
          }
        },
        "markets_covered": {
          "type": "array",
          "items": {
            "type": "string"
          }
        }
      }
    }
  }
}