{
  "evp_version": "1.0.0",
  "name": "Inkstack",
  "verdict": "PASS",
  "score": 87,
  "axes": {
    "trademark": {
      "status": "CLEAR",
      "jurisdictions_consulted": [
        "USPTO_bulk",
        "UKIPO_domestic",
        "EUIPO_live_API",
        "WIPO_Madrid_IR"
      ],
      "colliding_marks": [],
      "nice_classes_assumed": [
        9,
        42
      ]
    },
    "domain": {
      "status": "CLEAR",
      "tlds_consulted": [
        {
          "tld": ".com",
          "method": "RDAP_authoritative",
          "definitive": true,
          "result": "available"
        }
      ],
      "recommended_variant": {
        "domain": "inkstack.com",
        "registrar": "Cloudflare",
        "price_usd": 10.44
      },
      "aftermarket_observed": false
    },
    "distinctiveness": {
      "status": "STRONG",
      "cohort_corpora_consulted": [
        "yc_alumni_2014_2026"
      ],
      "platforms_consulted": [
        {
          "platform": "github",
          "status": "available",
          "url": "https://github.com/inkstack",
          "claimed": true
        }
      ]
    },
    "linguistic": {
      "status": "CLEAR",
      "advisory": true,
      "method": "static rule-based heuristic"
    },
    "cultural": {
      "status": "CLEAR",
      "sources_consulted": 9,
      "markets_covered": [
        "US",
        "UK",
        "DE"
      ]
    }
  },
  "verdict_id": "v_inkstack_a7f12bc",
  "issued_at": "2026-06-10T14:22:01.413Z",
  "disclaimer": "Clearance signal, not legal advice. Confirm with trademark counsel before adopting a name in commerce. Data sources have stated freshness windows; refer to coverage_caveat per jurisdiction.",
  "signature": "uRgztcYFdlvQZDk1834gOG88NDL8e/hgo5bjG/GIpUZAZy0F1CXyIX1bOfFr7EToJsihPuNgPXRszKQCexSABw==",
  "signature_key_id": "third-party-issuer-UNKNOWN",
  "signature_payload_digest": "04360aac47f170eed15c3f51f96578686dea94d4fcce6920f443484500353166"
}
